{
  "schema": "mission-desktop-execution/v1",
  "execution_id": "exec-mrgoyv8w-012f6e565f",
  "workspace_id": "wkspc-abc123def456",
  "capability": "email.send.external",
  "item_id": "task:send-once",
  "title": "Send email to person@example.com",
  "status": "queued",
  "input": { "to": "person@example.com", "subject": "Confirm", "body": "Preview body" },
  "input_hash": "sha256:aaaaaaaaaaaaaaaaaaaaaaaaaaaaaaaaaaaaaaaaaaaaaaaaaaaaaaaaaaaaaaaa",
  "idempotency_key": "12345678901234567890123456789012",
  "grant": {
    "schema": "mission-grant/v1",
    "grant_id": "grant-1234567890abcdef1234",
    "workspace_id": "wkspc-abc123def456",
    "capability": "email.send.external",
    "target": "person@example.com",
    "input_hash": "sha256:aaaaaaaaaaaaaaaaaaaaaaaaaaaaaaaaaaaaaaaaaaaaaaaaaaaaaaaaaaaaaaaa",
    "lifetime": "single_action",
    "max_executions": 1,
    "execution_count": 0,
    "created_at": "2026-07-11T20:00:00.000Z",
    "expires_at": "2026-07-11T20:10:00.000Z",
    "revocable": true,
    "revoked_at": "",
    "source": "authenticated_mission_mobile"
  },
  "created_at": "2026-07-11T20:00:00.000Z",
  "updated_at": "2026-07-11T20:00:00.000Z",
  "started_at": "",
  "completed_at": "",
  "error": "",
  "receipt_id": "",
  "trace_context": {
    "trace_id": "0af7651916cd43dd8448eb211c80319c",
    "enqueue_span_id": "b7ad6b7169203331"
  }
}
